{
  "zpds_version": "0.1.0",
  "prep_revision": "r0001",
  "parent_revision": null,
  "created_at": "2026-07-23T00:00:00Z",
  "pipeline": {
    "name": "zpds",
    "version": "0.1.0",
    "code_commit": "0000000",
    "config_version": "0.1.0",
    "config_uri": "configs/pipeline/default.yaml",
    "config_hash": "sha256:0000000000000000000000000000000000000000000000000000000000000000"
  },
  "conventions": {
    "time_unit": "ns",
    "time_interval": "[start_ns,end_ns)",
    "segment_time_origin_ns": 0,
    "length_unit": "m",
    "angle_unit": "rad",
    "quaternion_order": "xyzw",
    "pose_notation": "T_parent_child",
    "coordinate_system": "right-handed"
  },
  "changes": [
    "建立 WP0 最小 Prepared Revision。"
  ]
}
